{
  "schema_version": "1.0.0",
  "host_id": "escherichia_coli:562/K-12_MG1655",
  "display_name": "Escherichia coli K-12 MG1655",
  "taxid": 511145,
  "lineage_taxids": [1, 2, 1224, 1236, 91347, 543, 561, 562, 511145],
  "strain": "K-12 MG1655",
  "genome_accession": "NC_000913.3",
  "translation_table": 11,
  "version": "2.1.0",
  "codon_usage": {
    "subset": "highly_expressed",
    "n_cds": 312,
    "source": {
      "dataset_id": "ds_ecoli_he_cds_v2",
      "digest": "sha256:00ff00ff00ff00ff00ff00ff00ff00ff00ff00ff00ff00ff00ff00ff00ff00ff",
      "accession": "NC_000913.3",
      "n_records": 312,
      "license": "public-domain"
    },
    "table": {
      "AAA": { "aa": "K", "count": 18422, "fraction": 0.74, "per_thousand": 35.3, "relative_adaptiveness": 1.0 },
      "AAG": { "aa": "K", "count": 6471, "fraction": 0.26, "per_thousand": 12.4, "relative_adaptiveness": 0.351 },
      "CGT": { "aa": "R", "count": 9104, "fraction": 0.36, "per_thousand": 20.0, "relative_adaptiveness": 1.0 },
      "CGC": { "aa": "R", "count": 9012, "fraction": 0.36, "per_thousand": 19.7, "relative_adaptiveness": 0.985 },
      "CGA": { "aa": "R", "count": 1741, "fraction": 0.07, "per_thousand": 3.8, "relative_adaptiveness": 0.190 },
      "CGG": { "aa": "R", "count": 2703, "fraction": 0.11, "per_thousand": 5.9, "relative_adaptiveness": 0.295 },
      "AGA": { "aa": "R", "count": 1655, "fraction": 0.07, "per_thousand": 3.6, "relative_adaptiveness": 0.180 },
      "AGG": { "aa": "R", "count": 954, "fraction": 0.04, "per_thousand": 2.1, "relative_adaptiveness": 0.105 },
      "CTG": { "aa": "L", "count": 22110, "fraction": 0.47, "per_thousand": 48.4, "relative_adaptiveness": 1.0 },
      "ATG": { "aa": "M", "count": 12084, "fraction": 1.0, "per_thousand": 26.4, "relative_adaptiveness": 1.0 },
      "ATT": { "aa": "I", "count": 13601, "fraction": 0.49, "per_thousand": 29.8, "relative_adaptiveness": 1.0 },
      "ATC": { "aa": "I", "count": 10842, "fraction": 0.39, "per_thousand": 23.7, "relative_adaptiveness": 0.795 },
      "ATA": { "aa": "I", "count": 3106, "fraction": 0.11, "per_thousand": 6.8, "relative_adaptiveness": 0.228 },
      "TAA": { "aa": "*", "count": 918, "fraction": 0.61, "per_thousand": 2.0, "relative_adaptiveness": 1.0 }
    }
  },
  "trna": {
    "gene_copy_number": {
      "TTT": 6,
      "CTT": 2,
      "ACG": 4,
      "CCG": 1,
      "TCT": 1,
      "CCT": 1,
      "CAG": 4,
      "GAT": 3,
      "CAT": 8,
      "TTA": 1
    },
    "abundance": [
      {
        "anticodon": "TTT",
        "value": 3200,
        "unit": "molecules_per_cell",
        "condition_id": "cond_lb_37c_exp",
        "source": { "dataset_id": "ds_ecoli_trna_abund_v1", "digest": "sha256:112233445566778f112233445566778f112233445566778f112233445566778f" },
        "charged_fraction": 0.82
      }
    ],
    "wobble_rules_id": "crick_wobble_v1"
  },
  "tai": {
    "s_values": { "G:U": 0.41, "I:C": 0.28, "I:A": 0.9999, "U:G": 0.68 },
    "weights": { "AAA": 1.0, "AAG": 0.42, "CGT": 0.95, "CGC": 0.68, "CGA": 0.21, "CGG": 0.24, "AGA": 0.19, "AGG": 0.11, "CTG": 1.0, "ATG": 1.0, "ATT": 0.88, "ATC": 0.63, "ATA": 0.18, "TAA": 0.05 },
    "derived_from": "gene_copy_number",
    "optimized_against": null
  },
  "ribosome": {
    "elongation_rate_codons_per_s": 16.5,
    "ribosomes_per_cell": 26000,
    "active_fraction": 0.85,
    "footprint_codons": 10,
    "source": { "dataset_id": "ds_ecoli_growth_laws_v1", "digest": "sha256:cafebabedeadbeefcafebabedeadbeefcafebabedeadbeefcafebabedeadbeef" }
  },
  "growth_conditions": [
    {
      "condition_id": "cond_lb_37c_exp",
      "temperature_c": 37.0,
      "medium": "LB",
      "growth_phase": "exponential",
      "inducer": null,
      "inducer_concentration": null,
      "inducer_unit": null,
      "doubling_time_min": 25.0
    }
  ],
  "riboseq_tracks": [
    { "dataset_id": "ds_ecoli_riboseq_pooled_v3", "digest": "sha256:abcdefabcdefabcdabcdefabcdefabcdabcdefabcdefabcdabcdefabcdefabcd", "accession": "GSE000000", "n_records": 1310000 }
  ],
  "proteome_reference": {
    "source": { "dataset_id": "ds_ecoli_proteome_v1", "digest": "sha256:9876543210fedcba9876543210fedcba9876543210fedcba9876543210fedcba" },
    "unit": "molecules_per_cell",
    "n_proteins": 2350,
    "condition_id": "cond_lb_37c_exp"
  },
  "capacity": {
    "estimator_tier": 2,
    "theta": 1.0,
    "theta_unit": "fraction_of_native_demand",
    "sharpness_kappa": 8.0,
    "hill_n": 2.0,
    "g_max": 0.6,
    "uncertainty": { "sigma": 0.18, "method": "parametric_bootstrap", "calibrated": false },
    "fit_source": "ribosome_count_x_elongation_rate"
  },
  "data_completeness": {
    "has_codon_usage": true,
    "has_trna_gene_copies": true,
    "has_trna_abundance": true,
    "has_proteomics": true,
    "riboseq_mapped_codons": 1310000,
    "riboseq_genes_passing_qc": 2890,
    "supported_terms": [
      "usage.cai",
      "usage.gc_content",
      "structure.local_accessibility",
      "structure.mfe_global",
      "burden.growth_cost",
      "epistasis.dwell_deviation",
      "epistasis.context_naturalness",
      "kinetics.pause_concordance",
      "lm.naturalness"
    ]
  },
  "digest": "sha256:a1b2c3d4e5f60718a1b2c3d4e5f60718a1b2c3d4e5f60718a1b2c3d4e5f60718"
}
